,comment_id,comment_text,Sub1_Toxic,Sub2_Engaging,Sub3_FactClaiming
1924,2831,"@USER vous ne comprenez probablement pas non plus que l'AFD et les Verts sont actuellement égaux dans les élections, vos factions malveillantes sont partis",0,0,1
1925,2803,@USER il ne fera pas ça Il a du caractère,0,0,0
1926,1568,La naïve Luisa devrait devenir ingénieur au lieu de démontrer et avec ses inventions alors vraiment améliorer quoi,1,0,0
1927,3078,"Nous nous efforçons de ne pas offrir aux représentants de l'AfD un forum à leurs fins. Cependant, en fonction du sujet, il est nécessaire de faire intervenir eux-mêmes les responsables politiques de l'AfD au cas par cas.",0,1,1
1928,141,"""Ils veulent juste venir ici, venir ici, venir ici, ""non, voir les causes de l'évasion.",0,1,1
1929,2884,C'est un commentaire de haine classique avec une orientation populaire.,0,0,0
1930,1157,"à l'ère de la numérisation à venir à tous les niveaux qui nous attendent, car la pression de l'IA ou de l'IA va bientôt devenir chaude..",0,0,0
1931,2975,"Oh, hurlement de AfD-Nazis contre M. Daimagüler, vous appelez ça de la démocratie ?",1,0,0
1932,258,"Oh, oh, oh, oh, oh, oh, oh, oh, oh, oh, oh, oh, oh, oh, oh, oh, oh, oh, oh, oh, oh, oh, oh, oh, oh, oh, oh, oh, oh, oh, oh, oh, oh, oh, oh, oh, oh, oh, oh, oh, oh, oh, oh, oh, oh, oh, oh, oh, oh, oh, oh, oh, oh, oh, oh, oh, oh, oh, oh, oh, oh, oh, oh, oh, oh, oh, oh, oh, oh, oh, oh, oh, oh, oh, oh, oh, oh, oh, oh, oh, oh, oh, oh, oh, oh, oh, oh, oh, oh, oh, oh, oh, oh, oh, oh, oh, oh, oh, oh, oh, oh, oh, oh, oh, oh, oh, oh, oh, oh, oh, oh, oh, oh, oh, oh, oh, oh oh oh, oh, oh, oh, oh, oh, oh, oh, oh, oh, oh, oh, oh, oh, oh, oh, oh, oh, oh, oh, oh, oh, oh, oh, oh, oh, oh, oh, oh, oh, oh, oh, oh, oh, oh, oh, oh, oh, oh, oh, oh, oh, oh, oh, oh, oh, oh, oh, oh, oh, oh, oh, oh",1,0,0
1933,499,"@USER Nee, il est triste que la génétique soit encore plus importante dans certains milieux que l'attitude et l'individualité.",0,0,1
1934,684,"#HETZERIN Ã€@USER Ã€ #GEBLOCKT ! Ã Â""WEG est cette KRANCHE allemande - la personne ennemie ! Â""",1,0,0
1935,1612,L'électromobilité pure est une blague!!!!!,1,0,0
1936,104,@USER Où ont les pertes ! Avant que les pertes aient apporté votre argent à l'étranger . Tout mensonge et vous pensez que le petit homme est stupide et vous croyez cela ! ! ! Non Non,1,0,1
1937,44,"Très bien analysé - je suis parfaitement conforme...! Mais la prochaine fois, s'il vous plaît, @USER avec une orthographe orthographique, assez correcte....Merci!",0,1,0
1938,2194,"@USER Des requins immobiliers tels que Vonovia ou Allemands, et pas de locataires en location! Voici quelques faits inconfortables: https://m.manager-magazin.de/fotosehung/ueberblick-die-elf-grossen-deutsche-immobilie-ags-fotoshilung-100484.html",0,1,1
1939,2817,@USER ce qui leur donne le droit de juger sur Plasberg ainsi,0,0,0
1940,1315,@USER oh un plus intelligent! Le changement climatique est le réchauffement? Moi nouveau.,1,0,0
1941,435,L'Allemagne n'est plus plus digne d'un point de vue vital pour nous ! Il est temps que nous préparions tous nos valises et que nous laissions seuls les daiches avec leur nouveau roma/sinti migrants de Roumanie.,1,0,1
1942,1358,"Je ne sais pas ce qu'il se passe avec nos générations suivantes, on ne peut pas fumer autant.",1,0,0
1943,3175,"Il suffit de lire ce que vous autorisez et ne supprimez pas de DEUX pages de contributions. Vous aimez cela de "" @MEDIA "" ?",1,0,0
1944,2044,Combien de temps faut-il pour que cela dure 20-22?,0,0,0
1945,2016,"@USER: Pour un niveau mental plus élevé, cela n'a pas suffi, n'est-ce pas ? https://de.m.wikipedia.org/wiki/Troll_{Culture réseau)",1,1,1
1946,1737,Qu'y a-t-il de mal à @USER et à un démocrate pur ?,0,0,0
1947,1944,"Vous riez d'expériences scientifiques, ou c'est plus un rire d'être choqué par ce qui vous est révélé ?",1,0,0
1948,251,"@MÉDIUM : il s'agit de HEIMAT ! C'est le thème ! Ã§A POURQUOI vous cachez et cachez tous les "" cas isolés "" HUNDERT chaque jour Ã , où les gens d'autres pays cherchent chez nous un nouveau #HEIMAT ! Ã - et comment ils se comportent dans leur HEIM nouveau (et : NON ! ! - PAS TOUS ! ! Ã)",1,0,1
1949,389,@USER Quel est le rapport avec une pépinière? Juste une comparaison appropriée - ils ne semblent pas avoir beaucoup à inventer!,0,0,0
1950,566,"@USER C'est vrai, ils devraient parler beaucoup moins et se taire plus en retour.",0,0,0
1951,2101,"C'est encore une fois le prix de l'énergie qui contribue le plus au coût de la vie. Les prix à la consommation dans la zone euro ont augmenté de 1,7 pour cent en Allemagne en avril.Les prix de l'énergie ont le plus contribué au coût de la vie.Ils ont augmenté de 5,4 pour cent en avril.Les services ont augmenté de 1,9 pour cent et les produits alimentaires, l'alcool et le tabac de 1,5%.Les produits industriels ont augmenté de 0,2 pour cent.",0,0,1
1952,125,"@USER, quelle est votre opinion sur l'accord de partenariat économique ?",0,0,0
1953,2384,"Je ne sais pas qui a voté, mais je n'ai pas écrit mon ancienne année de naissance et mon métier sur la liste des baleines ! C'est comme ça que fonctionne la propagande allemande de la télévision. En Europe on ne compte pas encore les électeurs de la lettre, mais en Allemagne les chiffres définitifs sont coincés depuis hier soir à 18h00 !!",1,0,1
1954,2285,Je parle des pays qui ont été occupés par l'Islam !!!!!!!! Oh homme . L'histoire et la politique n'est pas votre spécialité,1,0,0
1955,2453,"Les services d'intérêt général sont privatisés, car la privatisation est bonne. ommmm International Le capital d'investissement qui s'évapore a droit à un rendement. - Il ne peut y avoir de monopoles. - Soins, hôpitaux mais aussi l'approvisionnement en énergie, l'eau, etc. - Privatisation, rendement, .... ommmm Signé: CDUCSUSPDFDP",1,0,0
1956,2293,"@USER , en Allemagne, chaque Aubergiste a le droit d'interdire la maison et il est permis aux individus de l'interdire. Mais si on obtient une interdiction de la maison simplement parce qu'on a une autre attitude politique, c'est contraire à l'article 1 de notre constitution. Qu'est-ce qu'ils pensent qu'il arriverait si un Aubergiste interdisait la maison à un musulman parce que d'autres musulmans propagent la terreur, tuent des couteaux et viols ou pratiquent des mariages d'enfants/de nombreuses personnes.",1,1,0
1957,753,Nous avons surtout besoin de logements moins chers et cette politique néolibérale n'aide pas les gens.,0,0,0
1958,2820,@USER pourriez-vous demander à votre ami comment cela s'est produit: https://www.facebook.com/530757183776023/posts/1159622474222821/,0,1,1
1959,204,"Oui, beaucoup de migrants se sentent clairement plus liés à ce pays que beaucoup d'indigènes - peut-être parce que ce qui est inné n'est pas si naturel? Ou parce que leurs ancêtres n'ont pas choisi ce pays à l'époque Hitler, donc ils n'ont pas ce sentiment de culpabilité?",0,1,0
1960,743,"C'est pourquoi plus de gens devraient également avoir la possibilité de faire des biens .Cela a également des conséquences positives dans le maintien des gens .Je sais de quoi je parle 1000 EFH construit et 5000 appartements, beaucoup aussi géré ce que j'ai vu chez les locataires incroyablement ils vont dans les maisons de construction sociale et regardez le vandalisme dommages...Doll",0,1,1
1961,2798,@USER elle devrait sentir un peu sur les dents - Roth derrière les transparents - Habeck,0,0,0
1962,484,"@USER ""Mandu"" me dit que tu ne connais pas ce mot, et que tu m'appelles ""étranger,"" confirme exactement ce que j'ai écrit dans le commentaire d'entrée, mais ne comprend pas beaucoup.",0,1,0
1963,2652,"Les électeurs de la CDU, du FDP, de la gauche, de l'AfD et du SPD ne sont pas les seuls à être diffamés.",1,0,0
1964,911,"@USER Vous semblez n'avoir fait que de mauvaises expériences avec les courtiers dans votre vie, je suis désolé pour vous ! Ce n'est pas juste ce que vous dites que le courtier est payé d'une seule page. C'est l'exception et seulement dans quelques régions du pays. Chez nous, dans NRW et beaucoup d'autres parties de l'Allemagne, la commission est partagée à mi-chemin ! Ce que vous écrivez sur l'intérêt du courtier, je ne peux pas le confirmer ! Mon intérêt en tant que courtier, c'est de réunir les deux parties à des conditions qui sont satisfaisantes pour les deux côtés !",0,1,1
1965,909,"@MEDIUM il n'est pas nécessaire de bien connaître Mme Barley pour comprendre exactement ce que les autres utilisateurs ont écrit ici ! Madame Barley n'a dit que la semaine dernière en regardant la journée dans la caméra ""Maklers encaissent trop d'argent pour ""NON""! C'est une insolence sans fond qui cherche la même chose et la meilleure preuve qu'elle fait exactement cela, une vengeance personnelle contre les courtiers! Elle ferait mieux de commencer là où il faut: enfin ancrer des conditions professionnelles pour la profession! Il ne peut tout simplement pas être que chaque mécanicien automobile, chaque coiffeuse ou toute personne non qualifiée sans aucune connaissance de ce que les choses dans le département II du livre de base signifient, une autorisation professionnelle en vertu de l'article 34c VRO!!!!! C'est la raison pour laquelle le courtier a une mauvaise réputation dans ce pays, et non pas le montant de la commission ou qui doit payer!",1,1,1
1966,2726,"M. Lübke n'est pas plus digne que n'importe qui d'autre qui est soumis à la violence chaque jour en Allemagne, où les médias ne font pas un tel hype, bien sûr, l'acte doit être condamné.",0,0,0
1967,2396,"@USER, malheureusement, certains d'entre nous ne sont toujours pas vraiment arrivés en Bavière à Munich. Malheureusement!",0,0,0
1968,2189,Personne n'est...,0,0,0
1969,68,"Mais les femmes @USER sont souvent celles qui ne reçoivent pas assez de papier de pension pour l'éducation des enfants ensemble. Si un enfant est encore là et que la mère retourne au travail très tard pour cela, alors il a tout simplement la carte du cul. Et c'est là que quelque chose doit changer. Les mères devraient être calculées comme s'elles n'avaient jamais cessé de travailler quand elles retournent au travail après la naissance.",1,1,1
1970,573,"@USER Pour une bonne raison, le parti AfDer est de rejeter le fasciste Landolf Ladig, aka Bernd Hocke.",0,0,0
1971,1949,"@USER Savez-vous ce que sont les nihilistes ? Probablement pas. Si vous le saviez, vous en saurez plus sur vous-même... Nous libérerons les nihilistes et les athées, et nous provoquerons un énorme renversement social qui, dans toutes ses horreurs, démontrera aux peuples les effets de l'athéisme absolu, l'origine de la barbarie et des révoltes les plus sanglantes. Alors, partout, contre une minorité de révolutionnaires, les citoyens seront forcés à détruire ces destructeurs de la civilisation. Et les masses, déçues par le christianisme, se prolongeront sans direction, selon un nouvel idéal, mais sans savoir où ils doivent diriger leur désir d'une foi, seront enfin accueillis par la descente de l'enseignement pur de Lucifer...",0,1,1
1972,2158,"Nous avons renforcé le problème depuis 2015!!! Ce qui est logique, parce que si vous laissez 2 millions de personnes entrer dans le pays, il manque 2 millions d'appartements. Donc, maintenant c'est fini. Je lis.",1,1,1
1973,836,"@USER nö. Je vois cela différemment. L'introduction de la ""TVA sur le sol"" est directement contraire aux spéculations sur le sol, car cela augmenterait la charge fiscale sur les terres non utilisées d'environ 10 à 15%, ce qui aboutirait à une construction beaucoup plus efficace. En plus de cela, le revenu des ménages augmente pour l'essentiel. Ce ne sont là que quelques avantages de la taxe unique. Connaissez-vous le ""Henry George Theorem""?",0,1,1
1974,1261,"@USER j'ai aussi vu ce rapport. Buvez de l'eau, mais même boire du vin",1,0,0
1975,2653,et va trop vite pour acheter des vêtements bon marché fabriqués au Bangladesh et empoisonnés à cause de cette production.,1,0,1
1976,1708,Donc maintenant on doit nous forcer à réfléchir à certaines choses. J'ai toujours pensé que les pensées étaient libres,0,0,0
1977,203,"Recommandé de lecture: ""Tu es tellement allemand ! Ma vie dans un pays qui n'aime pas ses vertus , par Agnieszka Towaluk, Immigrantin de Pologne :-)",0,1,1
1978,1342,@USER Je parlais de la comparaison avec l'avion...,0,0,0
1979,850,"Contre la stupidité aide à l'éducation, plus, plus efficace!",1,0,0
1980,2341,"@MÉDIUM Honnêtement, c'est là que l'on veut retrouver le bon vieux pilori médiéval où l'on met ces gens-là. Je sais... pas éthiquement...bla bla... mais honnêtement... mais vous aimeriez aussi mettre l'un ou l'autre là-bas;)",0,0,0
1981,317,"@USER pour la énième fois: les personnes qui entrent en Allemagne depuis des pays sûrs ne sont pas des réfugiés, elles ne doivent pas être intégrées, elles doivent être expulsées le plus rapidement possible. Je pense que quiconque s'oppose massivement est anti-allemand. Il veut changer complètement le pays par des cultures étrangères. Ce n'est pas le cas, car les Allemands ont le droit de vivre selon leurs idées sur leur territoire. C'est le droit international.",0,1,1
1982,1489,@USER tja pour la grande masse il y aura les ânes pour les riches la taxis de vol de Digibär..,1,0,0
1983,1521,Conclusion du magazine Nordsee Magazine jusqu'à présent de loin le plus grand !,1,0,0
1984,3072,"En ce qui concerne le Seigneur Jung, expliquez-nous le ""nazi"" que vous avez décrit, sans pour autant relativiser les terribles atrocités commises par les nazis dans le 3ème Reich.",0,0,0
1985,3159,"@USER, expliquez-nous pourquoi nous ne pouvons pas placer les travailleurs clandestins dans leurs pays voisins, grands et riches, où ils peuvent vivre leur foi en l'âge de pierre!! Nous vivons la pire vague de violence en D par des personnes à qui nous pouvons offrir trop peu de perspectives. Il y a beaucoup d'esprits intelligents qui décrivent comment combattre les causes et résoudre mieux les problèmes dans les pays d'origine.",1,0,0
1986,2464,"... mes conclusions..."" nous voulons, nous voulons, nous devons ""... DAS était une émission de publicité pour la GroKo, rien d'autre...",1,1,1
1987,2193,@USER avec l'aimable soutien et l'approbation des libéraux et conservateurs locaux et d'une décision du gouvernement fédéral du même nom en faveur d'une solution axée sur le marché. Je vous demande de prendre cela en considération et de compléter les affirmations unilatérales suivantes!,0,0,1
1988,1427,Le problème des déchets nucléaires qui y sont associés est toujours évité par la non-REGRGT...Il serait judicieux de sortir de l'électricité du charbon et de prolonger la durée de vie de l'énergie nucléaire propre jusqu'à ce que l'on dispose d'une autre source d'énergie et d'un dépôt final...,1,1,1
1989,1522,"Pour moi dans le round, de loin le meilleur, tout ce qu'il a dit, je comprends parfaitement. Le pire était la fille arrogante et arrogante qui, à mes yeux, n'est rien d'autre qu'une imitatrice de cette Greta!",1,1,0
1990,2614,Le public applaudit pour tous les merdes sont probablement achetés,1,0,0
1991,1374,"De telles sortes d'humeur, mais les combattants de sofa depuis 50 ans et ??? avez-vous changé quelque chose, empêché ??? il y a le centre de tout ce que l'on peut et ce qui n'est pas ici. l'incident est une invention des philosophes pour nous maintenir à la bonne humeur et à l'espoir.",1,0,1
1992,760,"On a des appartements, des maisons vides.",0,0,1
1993,930,"Non, il semble que je sois du genre stupide d'électeurs qui, avant les élections, font à nouveau l'objet d'une campagne électorale.",1,0,0
1994,2388,"Les Verts n'ont augmenté que parce que la jeune génération ne l'a pas vécue à la fin des années 90, au début de l'an 2000, ce qui était sous la coalition rouge-vert.",0,1,0
1995,278,"Celui qui n'est pas enraciné avec son pays d'origine ne comprendra jamais l'importance du pays d'origine. Tout le reste n'est qu'un foyer, mon opinion.",0,0,0
1996,1101,"@USER Le contraire de vos vieilles idées du siècle dernier, disons que dans les années 50, vous semblez encore en vie.",1,0,0
1997,2140,"Qu'ils invitent les gens qui ont un rapport avec ça, mais qui ne peuvent pas vivre suffisamment.",1,0,0
1998,481,Et puis chaque peuple reçoit encore chez lui au moins un fasciste du NPD du très proche est.,0,0,0
1999,200,"... elle est différente pour tout le monde et certaines personnes ne peuvent jamais perdre leur maison, se casser dessus.",0,1,0
2000,3040,@USER et cela justifie l'extrémisme de droite et le racisme de la pire manière? C'est la seule chose que l'AfD peut faire: relativiser. Peut-on à nouveau très bien voir aujourd'hui.,0,0,0
2001,2885,"@USER, que savez-vous au juste de la valeur démocratique de notre Constitution ? Pouvez-vous me l'appeler maintenant et ici ?",0,0,0
2002,2174,"@USER , je suppose que la taxe sur le CO2 devrait être une taxe sur la migration.",0,0,0
2003,77,"@USER je sais bien que les politiciens n'obtiennent pas des milliards, mais cet argent de la CIG peut malgré tout s'avérer bon, et l'argent qui est donné par la BR dans tous les pays, ce qui pourrait être utilisé pour nos retraités et nos infrastructures.",0,1,0
2004,2177,@USER La question reste par Wen!!!,1,0,0
2005,93,"Grâce à ROT-GRÜN, les gens doivent aujourd'hui travailler 45 ans et gagner chaque mois le salaire moyen en Allemagne (3.500 €) pour avoir un droit à 1 200 € (avant déduction des cotisations sociales)... qui l'a fait (Prof. Sell a publié celui-ci dans l'émission de Böttinger)? Dans tous les gens qui entrent dans l'assurance de base axée sur les besoins, toutes les prévoyances privées sont prises en compte - comment cela ressemble-t-il au modèle de calcul de M. Heil?",0,1,1
2006,2705,@USER Je n'ai pas vu de fille. 3 femmes et 2 hommes.,0,0,1
2007,239,"@USER, la criminalité organisée a toujours existé. Ce sont des marchés d'éviction qui, en fin de compte, semblent plutôt réservés aux crimes de capitaux. Ceux qui sont beaucoup plus explicites sont des clubs rockers. Mais surtout les mafias ou les clans familiaux arabes n'ont pas tendance à être trop visibles, car cela perturberait les affaires. Une personne sans passeport allemand quitte ce pays beaucoup plus rapidement qu'un Allemand qui n'a pas de point de fuite à l'étranger.",0,1,1
2008,2872,Démocratique contre nationaliste populaire.,1,0,0
2009,1330,"Mais, 12000€ par envoi.",0,0,1
2010,619,Où vis-tu ?,0,0,0
2011,1436,économiserait de nouveau de l'énergie immédiatement désactiver tout ....maintenant.,1,0,0
2012,2256,"@MEDIA mais où est le petit du SPD ? Je suis très heureux que l'AfD soit également représenté, merci.",1,0,0
2013,951,"@USER Si tout le monde pouvait le faire tout le monde et gagner l'argent lui-même, mais il ne peut pas tout le monde dépend un peu plus qu'une imprimante d'avoir des jeunes",1,1,0
2014,2127,"@USER ""Proportional à la croissance économique""? Alors ces maisons devraient être construites en Chine, ici avec le GOKO ne grandira plus!",0,0,0
2015,1302,"Le bois pour les granulés , proviennent également de réserves naturelles en Roumanie , mais peu importe , ce qui rend certains les poches épais .",0,0,1
2016,130,"""Qu'est-ce que ces réfugiés économiques le plus souvent inculpés (sans évaluation, simplement comme un nom, il correspond aux faits) tu es une tête stupide. Ce n'est pas une évaluation.",1,0,0
2017,1327,L'écologiste Markus Lanz peut nous l'expliquer ?,1,0,0
2018,454,"@USER clair , l'Allemagne est un paradis pour nous canapé et où autre est la vie insoutenable gel ...",1,0,0
2019,1250,"Pourquoi cette peur d'une vraie controverse, pourquoi ne pas toujours laisser certains points de vue complètement hors de portée ? Les gens comme moi sont furieux !",0,1,0
2020,1875,"Bien sûr, qui peut payer un organe, alors la famille devrait avoir l'argent",0,0,0
2021,672,@USER ♥.,0,0,0
2022,1150,@USER Cela n'a rien à voir avec ça.,0,0,0
2023,1932,"@MÉDIUM Vous n'aimeriez pas rester dans les faits pour ne pas être qualifié de médium de mensonge ? Regardez ici: "" La mort cérébrale n'est pas égale à la mort La mort cérébrale ne signifie pas nécessairement la mort de quelqu'un, explique le philosophe et expert en éthique, le professeur Dieter Birnbacher. Il y a néanmoins de bonnes raisons de s'en tenir au critère de mort cérébrale pour le prélèvement d'organes. "" https://www.aerztezeitung.de/politik_gesellschaft/organspende/article/87025/organe de prélèvement-hirntod-non-egal-tod.html",1,1,1
2024,2567,"Propagande totale pour les Verts anti-Allemands... Quand le procureur prendra-t-il enfin part à cet abus du ""Gez"" en tant que financement illégal des partis!!!",1,0,0
2025,1269,"Il est évident que c'est le cas. Non seulement en ce qui concerne la question du changement climatique fait par l'homme, tous les éléments du cycle semblent totalement unanimes, mais même en ce qui concerne la ""mobilité en ligne"" qui est folle et importante. TOUTES les informations sur les personnes plus ou moins dignes de confiance et sur la manière d'atteindre l'objectif commun sont tout à fait sans importance à mon avis.",0,1,0
2026,2475,"...et pas seulement depuis hier et aujourd'hui, mais depuis plusieurs décennies... tout à coup, la GroKo est en harmonie paisible avec tout...seuls les personnes âgées doivent payer, personne ne parle de ce qui se trouve encore dans les étoiles...la loi sur les soins de santé 2018 a établi... ""À partir de 2019, chaque infirmière supplémentaire dans les hôpitaux sera entièrement financée par les caisses d'assurance maladie.""...Irtum, les résidents à domicile ont dû payer... ici seulement un exemple...https://www.ln-online.de/Nouvelles/Allemagne du Nord/Nouvelles-Pflegegesetz-Heimbeisten-muessen-plus-nombres",0,1,1
2027,966,"Le logement est un droit fondamental, car il faut réagir et ne rien avoir à faire avec une économie de marché libre.",0,0,1
2028,479,"@USER Seuls les Allemands de l'Est ont toujours été des Allemands. Et en soi, ils n'ont pas de problème avec l'immigration, parce que de nombreuses familles ont perdu leur véritable patrie en raison de l'imperfection de la guerre.",0,1,1
2029,2533,"Le ""succès"" des Verts réside clairement, d'une part, dans la faiblesse des autres partis et, d'autre part, dans le fait qu'ils se heurtent à un paysage médiatique presque totalement non critique qui ne fait plus son travail de demande critique et d'analyse. Les Verts jouent ainsi sur le piano de l'indignation morale comme à peine un autre parti et ils parviennent à distraire les autres de leurs propres faiblesses et erreurs.",1,1,0
2030,2962,Pas un mot sur l'islamisme,0,0,0
2031,761,"Stefano Heitmann, c'est vrai ?",0,0,0
2032,2413,"les autres dirigeants verts sont aussi de tels activistes de mitrailleuses, qui laissent peu d'occasion à d'autres de discuter",1,0,0
2033,1308,"Quand on est silencieux, on peut même entendre les Chinois rire du SPD, une société complètement hystérique dans les prises des éco populistes.",1,0,0
2034,1685,"@USER Pour moi, on aurait pu lancer une grande offensive pour gagner des gens en tant que donneurs potentiels. Par exemple, les médecins de maison. Tout le monde peut informer et consulter, bien. Même pour la banque de sang, etc. Mais pas par la loi pour faire des camps de pièces de rechange, comme je l'ai dit, ce n'est pas du tout correct. Imaginez que vous soyez envoyé aux universités par la loi après votre décès comme matériel d'exercice pour les étudiants - à moins qu'on ne contredise. Et alors vous ne savez même pas si votre volonté est respectée... Non, tout cela doit être volontaire.",0,1,0
2035,2463,"@USER ... je sais qu'il y avait un document, car il y avait même 400 euros de plus... parce que cela devenait public, les habitants devaient payer "" SEULEMENT "" 200 euros de plus...",0,0,1
2036,1198,Et quelle variante Donald Trump et Tim Wiese ont - ils lue en secret quand ils étaient enfants?,0,0,0
2037,3216,"De toute évidence, les pertes de voix pour la CDU et le SPD n'ont pas encore suffi; ces politiciens surpayés ne deviennent tout simplement pas intelligents; ce qui se passe au niveau de l'UE est insupportable; cela n'a plus grand-chose à voir avec la démocratie.",0,0,0
2038,2557,C'est là que les démonstrants professionnels sont bien soignés.,0,0,0
2039,1534,Le reste du monde se fiche d'une saleté et les Grecs Allemands qui peuvent sauver la Terre mon microcosme spirituel !,1,0,0
2040,2448,"Depuis plus d'une décennie, la situation se présente comme suit: les partis politiques, au lieu d'une politique tournée vers l'avenir, se sont laissés donner des chiffres trimestriels, annuels et annuels sur l'évolution de l'âge et les chiffres de la formation. RECOMMANDEZ-VOUS jusqu'à ce qu'il n'en soit plus ainsi et ensuite, après 20 ans, nous faisons quelque chose.",1,1,0
2041,755,"Bien sûr, vous ne voulez construire que des appartements à peine abordables et surtout pas pour le petit Portmonee !",0,0,1
2042,2145,"Et l'UE peut payer elle-même Google, monter et sortir. Je n'ai pas à enlever l'ARbeit à tous les doofen.",1,0,1
2043,254,C'est #KEINE HETZE ! ... c'est #TACHEN ET #FAKEN ! ... sur ce qui se passe tous les jours en Allemagne ! et sur ce qui se passe en Allemagne !,1,0,1
