,comment_id,comment_text,Sub1_Toxic,Sub2_Engaging,Sub3_FactClaiming
647,1720,"Problème ! Aujourd'hui, on ne peut plus faire confiance à personne si on n'avait jamais pensé qu'un pharmacien , médicaments cancéreux ont l'effet zéro . On aurait déjà ""fait"" des listes pour qu'il soit mieux payé .",0,1,1
648,1587,@USER Vous êtes disqualifié!,0,0,0
649,845,"@USER, seules les personnes âgées savent que c'est le cas. Ceux qui en ont bénéficié et les jeunes qui ne le savent pas. Mais ils ont déjà raison, la télévision et d'autres appareils électroniques sont devenus moins chers , mais c'est à cause de cela que vient presque tout de l'étranger bon marché (Chine), ne tient plus que 2 ans mais pas cher . 1400 DM de loyer pour 90qm , parce que vous avez raison , je ne sais pas non plus, 700€ pour 90qm , il y a aussi plus cher . C'est alors tout froid et on peut encore y mettre 40% pour vivre. Il faut vivre du reste , si l'un d'eux est encore là .",0,1,1
650,2075,"D'abord, je trouve la formulation mal choisie, parce que le logement abordable n'est pas plus rare, mais il n'y en a plus dans différentes régions! D'autres encore sont en train de discuter... Pour finalement améliorer la situation, voir l'impôt foncier. Les gens qui ont peu d'argent pourraient rapidement être aidés si l'argent du logement était adapté au niveau du loyer moyen réel. Les logements dits ""raisonnables"" qui seraient nécessaires pour l'argent du logement sont depuis longtemps passés et absolument irréalistes. Par exemple, si, à Augsbourg, un logement décent pour 1 personne peut coûter 435,00 euros pour l'argent du logement, alors c'est un coup au visage. Car il n'y a pas de logement inférieur à 10,00 euros. Et même un homme avec un salaire minimum ne reçoit pas du tout. Comme beaucoup d'autres, 1000 logements sociaux sont en argent, la dette ou/et l'absence de logement sont la conséquence de l'ajustement de l'argent du logement est une solution rapide.",0,1,1
651,225,100% de l'AfD chie sur les droits de l'homme,1,0,0
652,227,T'as entendu parler de guerres secrètes ?,0,0,0
653,630,@USER ach @USER ag,1,0,0
654,377,@USER où est un Bayer @USER?,0,0,0
655,1429,@USER L'idéal de l'espoir serait de conduire des voitures plus petites avec une limite de vitesse et de ne pas conduire l'enfant à l'école avec le SUV et prendre des petits pains...,0,0,0
656,1331,"Un M. Lanz qui est lui-même autant sur l'axe qu'il veut m'enseigner, qui pense qu'il est le seul à savoir lire, alors qu'au cours de ses spectacles, il répète souvent, cite encore et encore le même,",1,0,1
657,121,"On pourrait dire qu'il était prévu depuis 21 ans, mais moi aussi je n'ai commencé que depuis 5 ans à m'occuper intensément de la politique. Avant cela, j'ai toujours couru à côté de N-TV ou N24 jusqu'à ce que j'ai remarqué qu'il n'y avait que des ""nouvelles"" et qu'il n'y avait pas d'infomations. Cela montre aussi la tendance à la couverture de nombreuses émissions. Les arpenteurs ne sont pas informés objectivement. Oui, une grande partie de la télévision publique et du pivat est tendancieuse et donc difficile à utiliser. Et oui, il y a aussi de bonnes émissions publiques, comme l'émission Monitor, l'établissement, l'histoire en premier et plus. Seul le narratif des médias est par économie, par USA et par OTAN. Des liens importants ne nous sont guère expliqués. Par exemple, le système monétaire, l'euro, le commerce extérieur, les accords de libre-échange, les guerres économiques et de matières premières, la charte de l'ONU, les autres causes de fuite, les documents de village de Lamb, l'Agenda 2010, les retraites et les retraites.",0,1,1
658,1690,"Dis-moi ...veux-tu comparer une personne à une ""rogue""?? Comme impertinent !!",0,0,0
659,515,"@USER, ce n'est pas ce sentiment, c'est la maison qu'il faut gagner.",0,0,1
660,902,"@USER en tant qu'agent immobilier, je dois compter sur ce que le propriétaire m'a dit pour beaucoup de choses. C'est pourquoi il doit être tenu pour responsable dans le cas d'espèce. Le vendeur de voiture n'a pas à blâmer le logiciel de tricherie. Cependant, si l'agent immobilier ""consciemment"" de fausses informations, je suis tout à fait avec vous.",0,1,1
661,1211,"Donc dans les entreprises ""normales,"" il y a des descriptions d'emploi. Chacun ou n'importe qui qui y fait un travail particulier reçoit le même argent. Je ne connais pas d'employeur, où les femmes qui font le même travail obtiennent moins que les hommes - qu'il s'agisse de la chaîne de montage, de l'entretien ou d'ailleurs! On ne peut pas comparer les pommes avec les poires. Si quelque part il y a ""Aide à la production E4"" alors il y a un groupe de salaires 4. Si quelque part il y a ""Entretien E6"" alors il y a un groupe de salaires 6.",0,1,1
662,2111,@USER On ne peut pas être aussi aveugle.,1,0,0
663,477,Palsberg n'a jamais eu de niveau,0,0,0
664,2889,"Outre les insultes personnelles et les thèses confuses, le commentateur d'entrée n'a absolument rien à offrir.",1,0,0
665,853,Personne n'a encore eu l'idée.,0,0,0
666,2555,"La taxe sur le CO2 sera...une deuxième taxe sur la valeur ajoutée, puisque tout ce dont nous avons besoin doit être transporté, et qu'il ne peut donc pas y avoir de taxe sur le CO2 neutral, il y aura des hausses de prix générales.",0,0,0
667,369,"Elle a deux tiers de temps de parole, elle est arrivée.",0,1,1
668,1480,trois vols pour les citoyens ordinaires.,1,0,0
669,12,@USER Télévision d'Etat !,1,0,0
670,872,30% de l'arrivée???,1,0,0
671,2151,Connaissez-vous le groupe Juif dans l'AfD ?,0,0,0
672,2343,@MÉDIUM Jaja... mais secrètement... ?;) Bonne soirée !,0,0,0
673,1096,@USER mais vous?,0,0,0
674,1265,"Nous n'avons pas besoin d'apôtres moraux et de prédicateurs du monde des médias, mais de vrais esprits et visionnaires, et ils me manquent dans toute l'action.",1,0,0
675,458,"@USER oui, je me sépare de toute cette société stupide bavarde. Schlitzohr numero 2. Pour rester juste , je n'ai rien contre les citoyens ordinaires qui ne font aucune différence entre les immigrants et les Allemands bio . Do you understand what I mean ? If yes please thumbs up",1,0,0
676,2397,"@USER, parce que nous sommes 6,2 pour cent au sein du groupe de l'Union et parce que nous sommes bons !",0,0,1
677,393,"@MÉDIUM, eh bien, j'aime être surpris.",0,0,0
678,1047,Comment cela?,0,0,0
679,2711,Mieux vaut ne pas l'exprimer !,0,1,0
680,2458,"@USER Oui, j'espère qu'il y aura aussi la pension d'un infirmier ! Oh, c'est-à-dire maintenant les infirmières",0,0,0
681,2735,@USER Pari que vous êtes assis devant la télé pour ne pas rater tout simplement,0,0,0
682,749,"Lorsque la ""TVA sur le sol"" est introduite, le nombre de logements augmente automatiquement grâce, entre autres, à la compression du logement dans l'espace urbain. Un bel effet secondaire de l'impôt foncier est que non seulement les loyers diminueront, mais que de nombreuses personnes auront également des revenus plus élevés, parce que les charges fiscales totales diminueront.",0,1,1
683,3173,@USER .Tout est connu. Mais les Verts ne veulent pas entendre parce que peu importe,1,0,0
684,2654,@USER je préfère ne pas écrire ici ce que je pense des sympathisants AfD. Seul votre commentaire est pathétique.,1,0,0
685,2487,"Les verts, nous n'avons jamais eu une seule catastrophe à l'époque de Schröder rouge vert",0,0,0
686,2241,@USER Êtes-vous sur le coup ? Super ;-) Ã©quipe Boris Palmer Watch,0,1,0
687,2329,"Chez la femme, c'est seulement la phrase qui m'a plu Chez moi, l'école était gratuite chez elle.",1,0,0
688,3113,L'émission d'hier était pure AFD bashing. Qui est responsable que c'est maintenant en Allemagne les anciens partis et seulement les anciens partis. Qui nie est un sympathisant des anciens partis?,0,0,0
689,2749,"@USER vous avez travaillé ici toute votre vie ou même vous avez reçu de l'argent de nos ouvriers , ils font à leur régime les prédateurs mais pas à notre peuple nous ne pouvons rien pour votre politique et ne sont pas disposés à partager notre argent durement gagné avec tout et tout le monde",1,0,0
690,935,"@USER La bonne femme parle de 7 pour cent. Quand un appartement est vendu en tant qu'objet d'investissement, il s'agit d'abord du pourcentage de commission. Ensuite, quand il est loué en tant que 2 locations à froid, je comprends. Mais cela ne change rien au fait qu'il soit donné en fin de compte en location au locataire.",0,0,1
691,438,@USER demander le journal d'image . Mon cher zinni ey,0,0,0
692,416,Ça me plairait beaucoup.,0,0,0
693,2740,Ce n'est pas pour rien qu'Augstein a appelé la CDU (Mme Merkel) la mère de l'AfD! CDU/CSU appartient aussi rapidement que possible au passé que l'AfD.Je vais mieux.,0,1,1
694,965,@USER Wien est généralement plus cher que Berlin.,0,0,1
695,1177,"Le débat à court terme, la Nouvelle-Zélande ou le changement climatique et la jeunesse serait intéressant.",0,0,0
696,2049,@USER tant que ce n'est que dans de telles émissions et pas à un moment donné s'il a quelque chose à dire.,0,0,0
697,691,"Je connais 3 familles qui ont une maison de près de 300 m2 tant que ces gens sont tellement encouragés à construire des maisons si grandes pour si moins de+ personnes, tant que ces personnes égoïstes n'auront pas à construire sur trois des plus petites et à donner des terres pour d'autres petites maisons. Nous avons 120 m2 mais il y avait aussi 5 personnes. Il faut enfin interdire de construire des maisons si grandes si ce n'est pas une maison de famille. En outre, il y a beaucoup de maisons vides qui se rouillent ainsi. On pourrait les démolir et prendre ces terres pour de nouvelles maisons. Mais non, personne ne veut vivre sur la campagne. J'aime agrandir les villes jusqu'à ce qu'on soit à l'arrêt des villages et qu'on détruise les forêts et l'habitat des animaux. Nous sommes tellement égoïstes que tous les autres êtres ne sont plus égoïstes.",0,1,1
698,724,@USER Il s'agit de ce que l'agent immobilier se fait.,0,0,0
699,2100,"D'accord, alors je suis calmé !!",0,0,0
700,3090,"Des frontières ouvertes pour les islamistes. S'ils ont des enfants, ceux-ci finiront par les remercier!!",0,0,0
701,2806,@USER Comme la vôtre ici??,0,0,0
702,729,"""Le droit de l'homme Le logement en Allemagne est malheureusement inestimable?"" Ce titre est grotesque de stupidité. Il suffit de regarder l'évolution du nombre de logements abordables.",1,1,0
703,2589,"@USER Vous pouvez le faire vous-même. C'était la première guerre contre le droit international après Hitler, conduite par des pêcheurs, et jamais poursuivie par Schröder lui-même. Une honte.",0,0,1
704,3145,"@USER Pourtant, la socialisation en tant qu'homme réel varie d'une région à l'autre.",1,0,0
705,2502,@USER 26% sont les Allemands?,0,0,0
706,2069,"J'ai de plus en plus de mal à manger de la viande quand on vit en train d'être produit dans le diable et puis comment !! Alors il y aura le printemps et il y aura le diable qui sort de la nourriture et le lisier comme d'autres, on pense que si on voit chez nous dans la région, on voit le pays s'évaporer ce qu'on conduit en quantités sur un seul coup.......On s'étonne des niveaux excessifs de nitrates dans les eaux souterraines??????? Comme dans les années 70, 1 fois par semaine de viande sur la table serait heureux à un prix équitable avec un élevage bon et sain ..Ce serait tout aussi bien pour la santé!",1,1,1
707,1372,"Il s'agit d'une taxe somptueuse sur l'essence et le diesel. A-t-il également indiqué au monde - rédacteur en chef du groupe de sauteurs Poschardt...Le petit homme doit payer en référence au climat,et la politique continue...",0,1,1
708,1771,"Je vais faire un don de sang de mon plein gré, ce serait une fin immédiate si j'étais obligé de le faire, et je le vois de la même façon avec le don d'organes.",0,0,0
709,2721,"Maintenant, on a un autre sujet dans lequel on peut s'éclater. Qu'en est-il de l'islamiste dans le pays. Il n'y a que des politiciens qui ne peuvent rien faire là-bas, il faut attendre qu'il arrive quelque chose, ils deviennent de plus en plus nombreux.",0,0,0
710,280,"Comme c'est mignon, les gens en colère sont de retour et se sentent désavantagés, et ils s'éloignent du sujet. Les réfugiés, comme @USER l'écrit si bien, sont responsables de ne plus avoir de maison. La vie est si simple quand on trouve toujours un pellbock dans son pays. Ou @USER, toi, sans foyer?",1,0,0
711,1554,@USER: https://fr.m.wikipedia.org/wiki/Troll_[Culture réseau],0,0,0
712,973,"A côté de cela, quand on exproprie les appartements qui doit les gérer l'État du Sénat berlinois alors chaque réparation dure aussi longtemps que le BER ...Doll est ce genre de chose en politique",0,0,1
713,2351,"La plupart des personnes à l'écart de la prise en charge ne savent pas du tout pourquoi les infirmières quittent les soins qu'elles aiment trop.Elle s'assure que la formation est obligatoire sur la chambre de soins et donc que l'association professionnelle des infirmières, la DBfK, ici il n'y a pas de bonnes affaires avec les employés de la maison de repos.",0,1,1
714,506,"Je ne laisserai personne m'aimer de chez moi, et je ne me sentirai pas toujours mal parce que mon père est un Turc.",0,0,0
715,884,"@USER voulait dire sarcastique parce que la construction était moins chère dans les années 70...aujourd'hui, la construction est trop lourde en raison des exigences.",0,1,1
716,801,@USER Joyeux pour toi ma maman Lui aussi....,1,0,0
717,657,"Autrefois, on faisait des recherches, aujourd'hui on se sert des médias sociaux que l'on condamne toujours comme ça. On devrait vous réduire votre salaire élevé. Ce que nous payons les spectateurs....",0,1,0
718,466,@USER du frecher bengel du,1,0,0
719,2314,Reil a beaucoup trop de temps de parole.,0,0,0
720,2857,Vous ne savez pas non plus ce que signifie l'incitation populaire.,0,0,0
721,3158,S'il vous plaît n'oubliez pas de frapper @USER!!,0,0,0
722,1652,"Donc... encore une fois, tout le monde comprend ! https://www.facebook.com/andreas.turschmann.3/videos/1244161859075732/",0,1,1
723,1090,@USER Et pourquoi pensez-vous cela? Toute la camomille négative des hommes ici doit avoir une raison!,1,0,0
724,1597,@MEDIUM je vous ai demandé pourquoi le courrier a été supprimé par quelqu'un où il est exposé combien de fois Luisa vole ?,0,0,0
725,10,"Après moi, le déluge",1,0,0
726,736,La propriété @USER rend particulier,0,0,0
727,1911,Les États membres ne sont que les nains européens.,0,0,1
728,1790,"Imaginez ceci pour les animaux: la vache reçoit un nouveau pansen, le vin refait, .... le chien d'écumeur, je suppose, parce qu'il obtient déjà de nouveaux parfums et mange le cerveau de son maître;) je ne veux pas d'organes étrangers, je n'en donne pas le sien. je ne suis pas une créature de Dieu pour cela. Je suis ici en train de flâner les affaires. Je connais//ai connu des personnes qui ont beaucoup souffert avant et après les transplantations. mais vous n'en parlez pas.",0,1,0
729,1038,"@USER garde des miroirs, tu crois que tu as de l'argent ?",0,0,0
730,2450,"Les partis politiques ne sont que des partis gouvernementaux parce qu'ils reçoivent en tant que tels du temps libre et bienveillant modéré. Des alternatives, et je ne parle pas maintenant de l'AfD, ont été et ont été ignorés dans la terre. L'évolution est évidente depuis 20 ans, au plus depuis 10 ans. - Maintenant, les dirigeants des partis politiques au pouvoir de mettre de nouveau à disposition des partis réactionnaires le temps de la publicité est une mosaïque dans une grande image qui forme mon reproche à la télévision gouvernementale.",1,0,0
731,2523,@USER Qu'est-ce qui ne vous convient pas ?,0,0,0
732,1603,"@USER, je vois juste que toi aussi tu voles autour du monde, et que d'autres se tapent avec ton écorhétisme.",1,0,0
733,428,Qu'est-ce que j'ai à voir avec le fasciste Erdogan ? Et tes condoléances peuvent te pousser là où le soleil ne brille jamais.,1,0,0
734,2775,@USER devrait être invité à consulter un vert sur ce sujet https://www.facebook.com/530757183776023/posts/1159622474222821/,0,1,1
735,3047,"Cette haine et cette hantise sont nées parce que l'État et la presse se sont tournés contre son peuple. Maintenant, l'État se livre lentement mais sûrement à la police et à l'armée... partout dans les nazis!???? Les enfants sont élevés pour désobéir à tout. Il n'y a plus de scolarité obligatoire par exemple. Qu'est-ce qui se crée? Démocratie? Certainement pas!",0,0,0
736,1282,"Dites et écrivez 100 000 vols partout dans le monde le jour!! Et l'automobiliste est l'idiot!! Juste une fois, ces avions volent avec de l'eau et sont à 100% propres navires qui naviguent à des milliers par jour dans les mers et les voies navigables, donc aussi avec ce qu'ils conduisent et sont 100% propres seulement l'automobiliste stupide est une fois de plus de la faute de tout!! Je demande qui ici fout la mer!!! Et pourquoi aussi croire!!!",1,1,1
737,2429,"Maman m'apporte la casserole, l'estomac qui coule le mieux contre la diarrhée.",0,0,0
738,1917,"Si Jésus avait été donneur d'organes, quelle aurait été la rédemption?",1,0,0
739,668,C'est bon à entendre !,0,0,0
740,92,"Où les politiciens travaillent Hart ! Au Bundestag, ils vont quand ils veulent dormir dans des débats, et bien, avec des buffets et des dépôts si difficiles, ils doivent tous retourner dans leurs anciens emplois après 4 ans. Sans droits à pension",1,0,1
741,2935,Très bien mis au point la stratégie de discussion de la Nouvelle Droite et son Gramscisme de droite.,0,1,0
742,1549,"Comme d'habitude, Lanz était ""faible """,0,0,0
743,998,C'est ainsi que se présente la réalité: https://www.bz-berlin.de/berlin/kolumne/so-évident-rouge-grien-global-actif-de-maisons-in-berlin?fbclid=IwAR0YlENHpg3gtEvIGViZueghHqEo4_zIDGXrDQNhA4YF34KWGCRQmk00,0,1,1
744,1365,@USER: L'avenir joue de toute façon en Asie. Personne ne s'en soucie si l'Allemagne sacrifie une autre industrie clé,0,1,0
745,1161,@MÉDIUM demande la réponse à @MÉDIUM dans la main-d'œuvre des femmes et des hommes qui est sous pression et qui est sur la touche ou tout le même...,1,0,0
746,205,Non:-) où c'est bon.,0,0,0
747,3162,"@Médium oui, merci, l'essentiel s'efforce de contribuer au dialogue de fond.",0,1,0
748,1825,@USER Aucune loi ne m'oblige à faire des choses que je ne suis pas.,0,0,1
749,1896,Moi non plus !,0,0,0
750,669,Mille cinq cents likes!!!,1,0,0
751,417,"Qu'est-ce qu'une discussion stupide . Maintenant, nous sommes complètement stupides . Je dois arrêter .Je vais avoir des maux de tête .",1,0,0
752,2305,"Cela n'a rien à voir avec le populisme, mais seulement avec la violence et la criminalité.",0,0,0
753,1242,"@MÉDIUM ils vont dans la rue parce qu'il est chick de sécher l'école et parce qu'il y a une Suédois hypnotisée. En principe, ils sont contrôlés par les médias. En ce qui concerne les voitures électroniques, je demande un fait honnête car elle n'est pas non plus très aimable à produire les batteries. Je suis un grand fan de leur émission, mais ils invitent des invités qui ont la connaissance de la matière et qui ne sont pas guidés idéologiquement. Même le fondateur de Greenpeace raconte aujourd'hui quelque chose d'autre. Personnellement, je suis quelqu'un qui aime entendre l'opinion des autres pour que l'on ait une base sur les faits. Les discussions matérielles et factuelles ne changeront rien, de sorte qu'il y ait une véritable lumière. Même si cela ne correspond peut-être pas au concept de leur émission.",1,1,1
754,1914,@USER ! Quelle sorte de contrainte ? On peut contredire. Mon Dieu encore une fois.,0,1,1
755,777,À peu près la chose la plus scandaleuse et la plus fausse que j'aie jamais vue dans l'émission.,0,0,0
756,2243,Hach famille chevalier également au départ... Était clair... //Equipe Boris Palmer Watch,1,0,0
757,763,"@USER à Berlin, ça fait un siècle qu'il y a eu une erreur !",0,0,0
758,1185,En plein dans le mille,0,0,0
759,1955,"Est-ce que c'est le cas ? Au moins opfisch ? Dans l'exemple, vous pouvez voir ce que l'ensemble peut accepter. https://noizz.de/savoir/homme-s'absente-en-tête-transplanter-weg-Familiengluck/jqh1wex",0,1,1
760,339,"@USER Je pense aussi à tous les descendants de personnes de Bohême, Prusse orientale, Poméranie, minorités allemandes en Hongrie, Serbie,... aux retours d'Israël, États-Unis, Amérique du Sud, de la RDA à la RFA, des anciens aux nouveaux Länder, etc. . . . . . . . . . . . . . . . . . . . . . . . . . . . . . . . . . . . . . . . . . . . . . . . . . . . . . . . . . . . . . . . . . . . . . . . . . . . . . . . . . . . . . . . . . . . . . . . . . . . . . . . . . . . . . . . . . . . . . . . . . . . . . . . . . . . . . . . . . . . . . . . . . . . . . . . . . . . . . . . . . . . . . . . . . . . . . . . . . . . . . . . . . . . . . . . . . . . . . . . . . . . . . . . . . . . . . . . . . . . . .",0,1,1
761,424,"La femme n'a pas vraiment discuté de manière objective, et la simple demande pour laquelle tant d'Erdogan ont choisi de s'occuper personnellement du questionneur est tout simplement stupide. Ne pas laisser les gens parler semble être un passe-temps.",0,1,0
762,3243,@USER. Ils attendent,0,0,0
763,3022,"Remettre l'AfD en responsabilité pour le meurtre cruel montre une fois de plus que les partis populaires ne s'arrêtent même pas dans un cas de deuil. On se sert et on utilise la victime pour la campagne électorale sur le dos de l'AfD. De quel droit rend-on l'AfD responsable de ce meurtre ? Qui a fait en sorte que l'AfD s'arrête ainsi ? Sous quelle pression les partis populaires et quelles craintes doivent-ils avoir à perdre les élections du Landtag à l'Est quand ils ont recours à des moyens populistes pour démolir un parti démocratiquement élu - comme il faut le constater. La question de la culpabilité n'est pas résolue par les partis, c'est le ministère public ou on pourrait dire que c'est une atteinte à la réputation.",1,0,0
764,2009,"@USER oui, au plus tard avec votre commentaire.",1,0,0
765,2714,@USER Qu'y a-t-il de si ridicule ? Avez-vous des arguments ?,0,0,0
766,232,"""Elle à l'égalité de la femme et de l'homme ou aux relations avec les homosexuels."" Et cela de la bouche d'un CDUer. C'est hypocrite. AKK annulerait immédiatement le mariage pour tout le monde si elle le pouvait.",1,0,1
767,2219,@USER -- h ARD !!,1,0,0
768,1476,Ça va être au moins ce que le BER est en train de faire sous la direction allemande.,1,0,0
769,1007,@MÉDIUM en encourageant qu'il y ait plus de petites sociétés résidentielles qu'il n'y en a de grandes.,0,1,0
770,1856,"que vous avez plus de temps pour le don d'organes pour cela la mort cérébrale, en fait logique, ne peut pas être retranchée.",0,0,1
771,3132,@USER Est-il dans l'intérêt de la société que nous devions nourrir des gens qui nous sont hostiles ? Vous devrez vivre avec le fait que tout le monde n'est pas coincé dans le sable. Votre désir de sauce consensuelle est déjà dû à la commodité. Et Toi et tes semblables aimeriez le libre-échange.,1,0,0
772,1252,"Il y a beaucoup de choses que nous pourrions faire pour faire du bien à l'environnement et pour maintenir notre mode de vie à long terme. L'hydrogène en tant que carburant n'est pas un SiFi mais il existe déjà. Cela ne coûte pas un emploi, mais même des emplois. Plus d'énergie verte, plus d'infrastructures pour l'hydrogène et un travailleur industriel VW, peu importe ce qu'il construit pour un moteur. Les bateaux de croisière sont inutiles pour se reposer il y a 100 autres possibilités de vacances. Manger moins de viande n'est pas seulement bon pour les animaux et la santé, mais aussi bon pour le climat. D'autres pays avec le savoir-faire allemand et s'il faut aider à devenir plus vert. On peut faire beaucoup de choses, mais il faut aussi être volonté de le faire et payer la facture que la nature nous donne JETZT avant qu'elle ne soit trop élevée.",0,1,1
773,2064,"@USER j'ai vu un rapport il y a quelque temps. Malheureusement, je n'ai plus les chiffres dans ma tête. Le paysan a reçu plus d'argent pour sa viande biologique . Mais le discount a gagné le plus. Trouvez l'erreur. Ce que le discount a frappé dessus était plus que l'usure.",0,1,1
774,2217,"Nous voulons construire une meilleure République avec Künert SPD et les LINKEN - il y a Guido REIL à ""hard mais juste"" une AMELIORATION !",1,0,0
775,2546,@USER Enfants et enfants d'enfants - c'est vrai - mais je veux dire quelque chose de tout à fait différent de vous;),0,0,0
776,2402,@USER qui est plus que corrosifs,1,0,0
777,2891,Les démocrates n'ont pas besoin d'acteurs nationalistes dans les talk-shows.,0,0,0
778,2688,@USER Dites-le aux Verts qui font la cour du pollueur... Avez-vous presque dit Hofreiter - Augstein a dit très bien: Merkel (CDU) est la mère de l'AfD! Et avec eux les Verts veulent sauver la RFA?! Ils vont s'en prendre comme FDP et SPD ...de 20% à ... disons 3% ?!,0,1,1
779,2606,"@USER, ""humain,"" c'est ce qui manque aux Verts jusqu'à aujourd'hui !",1,0,0
780,2024,un Allemand parle encore qui doit partir,0,0,0
781,552,"Puis-je ? je suis aussi Westler... Apparemment, ils n'ont pas réussi à s'intégrer dans cette société. Oui, il y a quelque chose de dingue quand on est escadronné par un peuple et qu'on le divise en Ossies et Wessies en même temps. Eh bien, il semble que l'idée absurde de la pureté génétique ait encore été explosée. Tout au-delà de la science. Envoyer un échantillon et attendre le résultat - mélange de promenades like a köter sort là, comme tout le monde.",0,1,1
782,207,"""Point de point"" semble un peu déterminé",0,0,0
783,2355,"Qu'est-ce que ces cadeaux aux retraités ! On a volé la pension aux retraités, c'est ça ?",0,0,0
